분류,제목,만료날짜,참여인원
행정,의정부에 다,2020-08-08,467명
교통/건축/국토,"장대교차로 ""입체교차로""로 건설해 주십시요.",2020-08-08,476명
인권/성평등,잠재적인 아동성범죄자들로부터 대한민국의 아이들을 지켜주세요. 우리의 미래입니다.,2020-08-08,"1,674명"
경제민주화,4.19,2020-08-08,292명
행정,서민의 피를 말리는 부실채권채무를 인수하여 추심을 전문으로 하는 회사의 허가 및 인가를 취소해주십시요,2020-08-08,309명
저출산/고령화대책,가족 요양보호사에게 왜 불이익을 주나요?,2020-08-08,409명
외교/통일/국방,"21세기 강제징병으로 인한 각종 사회적 병폐, 병영부조리, 이제는 개혁이 필요합니다.",2020-08-08,266명
교통/건축/국토,공공주택 분양정책에 심각한 문제가 있어 글 남깁니다.,2020-08-08,406명
교통/건축/국토,법치주의의 근간을 뒤흔들 수 있는 임대차3법의 소급적용 반대,2020-08-08,"27,940명"
인권/성평등,종교의 자유를 탄압하지 마세요.,2020-08-08,"2,393명"
보건복지,7월 10일(18시)부터 시행하는 교회에 대한 방역수칙 중 [소모임과 기도와찬양]에 대한 금지 항,2020-08-08,"3,558명"
인권/성평등,"교회 소모임, 행사, 식사 금지 등이 포함된 강화된 방역 수칙 시행을 멈추어주십시오.",2020-08-08,"1,919명"
육아/교육,어린이집 평가제 올해는 유예 부탁드립니다.,2020-08-08,883명
안전/환경,시험때문에 코로나위협을 무릅쓰고 학원가는 학생들을 위해 중학생 1학기기말고사를 취소해주세요,2020-08-08,940명
문화/예술/체육/언론,학교 운동장 공휴일 개방 요청,2020-08-08,194명
육아/교육,저희 아이가 아동학대를 당했습니다. 관련자들 처벌해 주세요,2020-08-07,"10,945명"
행정,정부의 교회 정규 예배 이외 행사 금지를 취소해주세요.,2020-08-07,"427,470명"
교통/건축/국토,임대차3법 소급적용,2020-08-07,"1,829명"
보건복지,주거지 다시 찾을수 있게 도와주세요. 강제퇴거 당해 한강공원에서 잠자리한지 11개월째.,2020-08-07,407명
인권/성평등,성범죄 사건은 법적으로 1/2 이상 여성경찰/판사가 전담할 수 있도록 해주세요.,2020-08-07,"1,141명"
안전/환경,위례신도시 북위례 하남 입주예정자입니다.,2020-08-07,"4,580명"
일자리,"""대형건설사 비정규직 부당해고""살려주세요",2020-08-07,"1,643명"
인권/성평등,조직폭력배의 횡포로 국민이 신음하고 있습니다!,2020-08-07,493명
경제민주화,주식 양도소득세 부과 당장 철회하세요,2020-08-07,609명
교통/건축/국토,아파트 분양가격을 반값으로 분양하라,2020-08-07,413명
기타,주식 양도소득세(20% ~ 25%) 폭탄 과연 바람직한 것인가..? 전업투자자라도 해서 먹고 살려는 사람들의 삶을 짓밟지 마셨으면 합니다.,2020-08-07,611명
교통/건축/국토,투기과열지구 피해자로서 대통령직의 소급적용을 원합니다.,2020-08-07,"1,795명"
경제민주화,수도권의 한시적 1가구 2주택 이외 주택 매수금지 특별법 제정을 청원 합니다,2020-08-07,287명
교통/건축/국토,다주택자의 세입자 전세금까지 포함해서 합산DSR을 빠른 시일 안에 적용해 주세요,2020-08-07,291명
정치개혁,청년이 희망하는 확실한 부동산 대책,2020-08-07,324명
안전/환경,차량통행,2020-08-07,143명
반려동물,'반려동물 가족 관계 증명서 기입' 추진하고 싶습니다.,2020-08-07,735명
교통/건축/국토,임대차보호 3법 소급적용하면 제3의 피해자인 저는 죽어야 되나요?,2020-08-07,"1,525명"
경제민주화,개정 임대차보호법(임대차보호3법)의 소급적용을 막아주세요,2020-08-07,"15,157명"
일자리,"우리는 ""떳다방""이 아닙니다.",2020-08-07,226명
정치개혁,방통위는 채널A 재승인 의결을 취소하라!,2020-08-07,"20,920명"
인권/성평등,"**사단 상급자의 가혹행위, 폭력행위와 사건은폐,축소의 진실을 밝혀주세요",2020-08-07,"2,579명"
교통/건축/국토,군위군수는 소보유치신청을 하라,2020-08-07,"3,111명"
행정,방위사업청의 부당한 행정처리를 시정해 주세요!,2020-08-07,277명
정치개혁,친일세력들의 입김이 반영된 화폐 인물에 대한 변경을 요청합니다!,2020-08-07,"19,981명"
교통/건축/국토,인천공항 입국시 제출한 국민들의 개인정보가 담당자에 의해 사적으로 남용되고 있습니다. 처벌 부탁드립니다!!!,2020-08-07,829명
외교/통일/국방,군에서죽은 내조카 국방부 재심의요청,2020-08-07,300명
경제민주화,도와주세요...제발..........대기업 **이 적폐적 갑질로 서민의 생계까지 위협하고 있습니다.,2020-08-07,358명
기타,[서울 복싱장 9살 성추행 사건] 도와주세요. 9살 딸이 중2 남학생에게 성추행 당했어요.,2020-08-07,"22,328명"
정치개혁,국회의원의 배신으로,2020-08-07,848명
육아/교육,"중학교 하나 만들자는 게 무슨 죄라고, 찢기고 철거돼야 합니까?",2020-08-07,507명
교통/건축/국토,**개인택시조합 특별감사를 실시 해주세요.,2020-08-07,861명
정치개혁,검찰총장 윤석열을 해임하라,2020-08-07,"5,867명"
안전/환경,충남당진자매살인사건용의자신상공개와처형을원합니다,2020-08-07,"13,791명"
교통/건축/국토,무능한 김현미 장관을 경질시켜 주십시오!,2020-08-07,"2,259명"
교통/건축/국토,내집 한칸 마련하는 것이 평생 소원입니다!,2020-08-06,"4,547명"
농산어촌,아버지께서 태양광 사기를 당하셨습니다 도와주세요,2020-08-06,917명
일자리,**** 코리아의 COVID-19 관련 대응으로 직원들이 고통받습니다.,2020-08-06,"1,390명"
인권/성평등,손정우 미국인도 불허 철회 강력 요청,2020-08-06,"8,219명"
문화/예술/체육/언론,고 최숙현 선수에게 가혹행위를 한분 모두 철저히 조사해서 강력한 처벌을 해주세요,2020-08-06,"3,441명"
인권/성평등,손정우 미국송환 거절 사법부를 규탄한다.,2020-08-06,"4,055명"
인권/성평등,세계 최대 아동 성착취물 사이트 W2V의 운영자 손정우의 미국 송환을 강력하게 요청합니다.,2020-08-06,"62,284명"
인권/성평등,아동 성 착취 영상 사이트를 만들어 유통하고 수많은 성범죄를 저지른 사회악 손정우의 재 재판을 청원합니다.,2020-08-06,"4,026명"
정치개혁,성범죄자 손정우를 부디 미국에 송환해주십시오,2020-08-06,"2,595명"
반려동물,락스 먹이고 네 발 묶고… 천안시 유기동물보호소 충격적 동물학대 의혹 밝혀주세요,2020-08-06,"2,822명"
교통/건축/국토,녹산 ***상가 불법건축물에 관한 억울함을 호소합니다.,2020-08-06,162명
보건복지,"공익제보 돌아온 건 무단해고 !   가짜환자 입원, 허위 진단서 발행, 면허 없는 직원에게 방사선(X-레이)촬영 강요,  향정(마약류)불법 취득 병원의사 처벌 해주세요.",2020-08-06,433명
교통/건축/국토,대통령님 더이상 침묵하지 말아주십시오.,2020-08-06,"1,578명"
교통/건축/국토,금번 국토부의 6.17 대책 및 소급적용 논란과 관련하여 금융위원회 담당 책임자의 징계를 요구합니다!,2020-08-06,"1,334명"
행정,자치아닌 일관성 없는 주민 죽이는 무사안일한 관치행정이 살아났다.,2020-08-06,239명
정치개혁,"21대 국회, 등원하지 않은 국회의원의 일하지 않은 6월달 월급을 회수해 주세요.",2020-08-06,"1,414명"
교통/건축/국토,"서민 등쳐먹는 악덕 건축업자의 처벌을 요청합니다. 갑질, 막말 판사의 처벌을 요청합니다. 아직도 우리 사회는 유전무죄입니다. 국민 여러분, 도와주세요!",2020-08-06,"1,544명"
반려동물,천안시보호소와 천안시청동물보호과의 만행 처벌해주세요.,2020-08-06,"29,201명"
경제민주화,청와대공직자및 국회의원  전공무원들에 불로소득 조사및 환수요청합니다.,2020-08-06,839명
인권/성평등,100억 가진자의 보험사기와 이를 수사한 검찰수사의 납득할수 없는 수사 처분,2020-08-06,239명
기타,채굴권 확보에 따른 국유림 사용 허가 요청 (산업통상자원부로부터 채굴권을 획득했으나 산림청에서 해당 광산이 소재한 국유림 사용을 불허한 내용임),2020-08-06,123명
행정,비영리민간단체 관리를 잘 해주세요!!,2020-08-06,298명
정치개혁,"국세청,관세청,금감원,금융정보분석원을 포함한 합동 수사단은, 권력자. 재벌. 대기업 등이 국.내외에  은닉한 불법자금 환수절차를 즉각 시행하라.",2020-08-06,347명
교통/건축/국토,제주항공의 이스타 인수를 강요하지 말아주세요,2020-08-06,608명
인권/성평등,평등을 주장하는 동성애 옹호를  절대 반대합니다,2020-08-06,"9,478명"
교통/건축/국토,대한민국 중도를 영국 식민지로 만드는 강원도지사의 만행을 막아주십시오! -투기자본에 황폐화되는 동아시아 역사문화 관광보고,2020-08-06,"12,619명"
기타,저는 코로나확진자의 가족입니다 다단계업체 폐지를 간절히 부탁합니다.,2020-08-06,573명
인권/성평등,웰컴투비디오 손정우 사건 철저한 재수사 및 미국 송환 여부 재검토 요청합니다.,2020-08-06,"5,394명"
농산어촌,청년 농업인을 위한 스마트팜 종합자금 정말 청년 농업인을 위한 정책인가?,2020-08-06,327명
기타,한국체육대학교 핸드볼부에서 지옥같은 가혹행위(폭행/성추행) 만행을 저지른 가해자에게 엄중한 처벌을 강력히 촉구합니다.,2020-08-06,"1,734명"
문화/예술/체육/언론,고 최숙현 선수를 죽음으로 몰고간 경주시청 전원에 대한 감사와 수사를 촉구합니다.,2020-08-06,"1,275명"
교통/건축/국토,"문재인 대통령, 국토교통부 장관, 금융위원장은 들으세요.",2020-08-06,817명
농산어촌,어민들의 조업과 생계를 위태롭게 하고 국내산 멸치 멸종을 조장하는 해수부,2020-08-06,208명
행정,해운정사의 이상한 문화재 지정을 해제 하거나 취소해주십시요,2020-08-06,"1,544명"
기타,네이버 카페 *********  운영진들의 비리를 파헤쳐 주세요.,2020-08-06,316명
교통/건축/국토,"디딤돌 대출, 보금자리론의 대상주택 주택가격의 상한선이 현실을 전혀 반영하지 못하고 있습니다.",2020-08-06,442명
농산어촌,민가주변 퇴비장을 막아주세요.  귀촌인들의 고충에 귀를 기울여 주세요,2020-08-06,409명
행정,코로나19확산의 주범은 광주시청 입니다.,2020-08-06,291명
일자리,방문판매업 우리가 죄인입니까?,2020-08-06,"1,811명"
교통/건축/국토,주민도 모르는 용도변경,2020-08-06,306명
문화/예술/체육/언론,체육계내 폭행 및 성폭행사건 재발방지에 대한 실제적인 제도적 보완을 건의합니다.,2020-08-06,887명
교통/건축/국토,무주택자 주거용 오피스텔 사기,2020-08-06,892명
교통/건축/국토,"문재인 대통령님이 말씀하신 2020년 7월 2일 ""발굴해서라도 주택 더 공급해라""에서 ""발굴""에 대한 국민제안입니다.",2020-08-06,203명
교통/건축/국토,"고위공직자, 국회의원 들의 부동산 대책 솔선수범 법제화 요청",2020-08-06,441명
외교/통일/국방,참전유공자가 보훈병원 위탁병원 이용시에도 차별없이 약제비를 감면 받을 수 있게 해 주십시요.,2020-08-06,238명
안전/환경,지속가능한 우리의 미래를 위해 에어컨으로 인한 과도한 탄소배출을 정부가 막아주십시오.,2020-08-06,591명
인권/성평등,"권대희 사망사고 재조명...성** 검사, 의료진 변호사 관련 조사해주세요",2020-08-06,438명
성장동력,전력사용 기본요금을 한시적으로 적용 바랍니다.,2020-08-06,147명
인권/성평등,손정우 신상공개 및 재산몰수와 모든범죄자에 대한 신상공개등,2020-08-06,"4,457명"
행정,임대사업자분들이 무슨 죄인가요 마녀사냥으로 몰지 마세요,2020-08-06,"19,348명"
교통/건축/국토,공공분양의 일반공급 비율을 늘려 주십시오. 무주택 중장년층의 정당한 청약 기회를 박탈하지 마십시오!,2020-08-06,754명
안전/환경,담배 판매 금지 요청,2020-08-06,328명
인권/성평등,웰컴 투 비디오 회원 전수조사를 위한 특별 수사 본부를 즉시 설치해주세요,2020-08-05,"81,070명"
인권/성평등,강영수 서울고법 수석부장판사의 대법관 후보 자격 박탈을 청원합니다.,2020-08-05,"529,144명"
인권/성평등,공정한 수사가 진행되어 가해자가 무거운 처벌을 받을 수 있도록 도와주세요.,2020-08-05,"1,228명"
외교/통일/국방,"늦은 밤 병사(장병)의 생명을 살린 한통의 휴대전화, 군인의 부모(보호자)와의 부대(군대) 내 휴대폰 사용시간을 연장해 주세요.",2020-08-05,720명
저출산/고령화대책,첫째아이 난임지원,2020-08-05,"3,123명"
일자리,주4일 근무제 도입을 청원합니다.,2020-08-05,621명
기타,연대보증채권을 소각해주세요,2020-08-05,514명
일자리,일용직 청년층들 피해 막아주세요.,2020-08-05,291명
일자리,**손해보험사의 갑질,2020-08-05,491명
인권/성평등,**전자 사내 **팀의 모욕/협박/인권침해 등 월권 행위에 대한 수사 요청,2020-08-05,"2,752명"
인권/성평등,한국힙합 'W그룹' 미성년자 성폭력 논란의 진실을 밝혀주세요.,2020-08-05,630명
육아/교육,**시 시립어린이집의 갑질을 고발합니다!!,2020-08-05,339명
교통/건축/국토,경공매로 취득한 부동산의 종부세 중과는 폐지되어야 합니다.,2020-08-05,"1,034명"
인권/성평등,n번방 구매자의 신상공개 불가 판결 재검토 후 신상공개 / n번방 관련 모든 가해자들의 신상공개를 원합니다.,2020-08-05,"12,058명"
문화/예술/체육/언론,골프장  식당및  그늘집  식음료  가격 인하  요구 합니다,2020-08-05,854명
안전/환경,분양가상한제만 피해가려고 공공의 이익을 무시하는  대치*지구재건축 착공을 재검토해주세요,2020-08-05,221명
기타,계획적인 사기.. 강력하게 처벌해주세요,2020-08-05,676명
기타,*** ** 전조등 반사판 결함으로 운전에 위험을 느낍니다,2020-08-05,239명
문화/예술/체육/언론,"광주 코로나 급증으로 인해 예식연기수수료면제 및 자율업종사업장 열체크,마스크,방명록작성의무화",2020-08-05,235명
육아/교육,"문화예술, 한류스타들의 산실인 서울공연예술고등학교를 지켜주세요",2020-08-05,"3,051명"
인권/성평등,악질  임대사업자 처벌해 주세요!,2020-08-05,398명
교통/건축/국토,공공개뱔로 동일 지구에  동일하게 수용된 토지에 대해 동일한 조건의 아파트 입주권이 주어 져야 합니다.,2020-08-05,158명
인권/성평등,경기도 용인시 **구 소재 반도체 오염 분석설비 제조업체를 살려야 합니다.,2020-08-05,139명
농산어촌,주택안정(비닐하우스 양성화),2020-08-05,290명
기타,호봉불평등,2020-08-05,332명
성장동력,대한민국에서 농업해서 죄송합니다!,2020-08-05,304명
일자리,민주당은 선거 공약대로 방통대 온라인 로스쿨을 신속히 개설해 주시기 바랍니다.,2020-08-05,418명
미래,배달***  요** ****** 서비스 문제점 카드체크기사를  힘들게 하는 이유?,2020-08-05,455명
안전/환경,"산업재해로(하악골 우측 턱 골절) 산재보험을 청구, 수술하고 치료하던 중 부정교합이 왔어요. 부정교합수술비 중 자가 비용이 1000만 원 넘게 나올 수 있다고 합니다.",2020-08-05,191명
교통/건축/국토,수원시에서 추진중인 어린이교통공원 리모델링 사업(축구장 등 체육공원으로의 변경과 지하주차장 건설)이 과연 어린이들을 위한 겁니까!!!!!!,2020-08-05,429명
일자리,우리사회의 고질적인 문제를 해결하고 대한민국의 행복한 미래를 위한 정책 제안입니다.,2020-08-05,133명
저출산/고령화대책,학교앞  지하주차장이 스쿨존에 진출입로??아이들의 스쿨존을 지켜주세요.,2020-08-05,158명
보건복지,정부에서 ‘입이 보이는 투명마스크(이하 투명마스크)’를 제작하여 청각장애인의 소통과 안전을 보장해주세요.,2020-08-05,329명
교통/건축/국토,(동의 동참 부탁드립니다) 617 정책발표후 갈피 못잡는 금감위. 은행. 국토부 담당자들 모두 경질해주세요 !!!!!!,2020-08-05,"1,705명"
교통/건축/국토,공공분양 일반공급 물량 건들지 말아주세요,2020-08-05,845명
문화/예술/체육/언론,대한민국을 대놓고 모욕한 한혐 유튜브 유저들에게 엄벌을 내려주세요,2020-08-05,623명
경제민주화,"주식 양도세 부과는 외국인,기관의 세수공백을 개인에게 전가할 뿐입니다",2020-08-05,686명
교통/건축/국토,서민의 내집마련은 투기가 아니라 서민의 평생 소망입니다,2020-08-05,473명
기타,6.25 전쟁 전사자 상훈추서에 대하여,2020-08-05,128명
기타,너튜버 리** 법적으로 처벌해주세요,2020-08-05,366명
인권/성평등,건물주 위력에 의한 상습 협박 및 권리침해,2020-08-05,155명
교통/건축/국토,정부는 GTX 전노선을 원안으로 신속히 진행해 주세요,2020-08-05,"2,890명"
기타,아이들과 웃을수 있게 도와주세요,2020-08-05,236명
교통/건축/국토,토지개발에 대한  부당함,2020-08-05,178명
육아/교육,광주광역시 유치원에 휴원이나 방학을 권고해주세요,2020-08-05,492명
미래,창원산업선은 지역의 균형발전을 위해 반드시 필요합니다.,2020-08-05,"1,192명"
교통/건축/국토,6.17대책 이전에 분양권매수자도 기존의 주담대 기준 적용부탁드립니다.,2020-08-05,281명
안전/환경,문 대통령님 꼭! 해결방안을 만들어주십시오. 층간소음에 대한 강력한 규제 및 방법을 만들어 주십시오.,2020-08-05,309명
보건복지,6.30개정된 확진자 이동경로 정보공개 개정안 반대청원,2020-08-05,252명
보건복지,면역성혈소판감소증(ITP) 치료신약에 대한 보험급여기준 완화를 청원합니다,2020-08-05,965명
보건복지,장애인이 직접가야 약을 받을수있는 정책을 바꿔주세요.,2020-08-05,404명
안전/환경,"광주에서 마스크착용,선택이 아닌 필수",2020-08-05,585명
보건복지,"장애인수급자의 생계를 위협하는 장애등급제폐지, 장애인의 기초수급비를 돌려주세요",2020-08-05,422명
문화/예술/체육/언론,불법사이트 단속과 저작권법을 강화해주세요!!! (10),2020-08-05,"2,643명"
기타,고령자 불완전 통신판매,2020-08-05,161명
보건복지,고3 졸업때 한국인의 음주능력을 교육시켜주세요! 금방 빨게지는 30% 한국인에게 한잔도 독인데 계속 술을 권해요 ㅜ,2020-08-05,514명
일자리,보안검색요원을 자회사로 남게해주세요~,2020-08-05,"1,281명"
육아/교육,중고교 봉사활동 금지요청,2020-08-05,"1,348명"
행정,주식 양도세 폐지가  당연,2020-08-05,439명
보건복지,난임비지원중 '공난포' 발생시 지원대상제외!!!! 별도의 지원책 마련해주세요.,2020-08-05,744명
행정,층간소음 7년 피해자 입니다. 층간소음 처벌을 강화해 주세요.,2020-08-05,281명
인권/성평등,촉법소년제도 폐지 해주세요,2020-08-05,"1,406명"
보건복지,단장증후군으로 살아가는삶을 응원해주세요,2020-08-05,385명
교통/건축/국토,민식이법 및 도로교통법 개정을 청원합니다.,2020-08-05,"2,209명"
육아/교육,"매일 무거운 책을 들고 등,하교 하는 학생들을 위해 온라인 교과서를 만들어 주세요.",2020-08-05,212명
교통/건축/국토,오토바이 소음때문에 잠을 잘 수가 없습니다.,2020-08-05,910명
교통/건축/국토,**** 임대분양금 날도둑,2020-08-02,598명
교통/건축/국토,집값 폭등의 주범인 주택임대사업자에 대한 세제 특혜 폐지를 청원합니다.,2020-08-02,"11,370명"
교통/건축/국토,경기도는 남북 균형발전 절대필요,2020-08-02,363명
일자리,***항공이 다시 날 수 있게 해주시길 부탁드리겠습니다.,2020-08-02,514명
보건복지,선원들은 바이러스가 아닙니다. 무조건 14일 자가격리가 아닌 합리적인 조치를 바랍니다.,2020-08-02,"11,430명"
육아/교육,**대 재단인 *** 재단 수사 의뢰 부탁합니다,2020-08-02,581명
문화/예술/체육/언론,서울공연예술고등학교의 예술계 특,2020-08-02,"2,580명"
행정,감일하남 눈물의 3호선 지켜주세요,2020-08-02,"2,183명"
기타,기숙사 환불 / **건설,2020-08-02,447명
안전/환경,응급환자가 있는 구급차를 막아세운 택시 기사를 처벌해 주세요.,2020-08-02,"735,972명"
외교/통일/국방,해군에 의해 은폐된 아들의 청해진함 홋줄 사고의 재수사를 간곡히 부탁드립니다.,2020-08-02,"30,739명"
인권/성평등,제친구의 억울함을 들어주세요,2020-08-02,"1,475명"
기타,지난6/28~29일 일산에서 괴한3명에게 묻지마폭행을 당했습니다.,2020-08-02,"1,886명"
인권/성평등, 국방부 자운대근무지원단장과 복지담당관을 고발합니다.,2020-08-02,360명
외교/통일/국방,국군복지단 (자운대 쇼핑타운) 처음 약속한 임대기간(10년) 보호를 요청합니다,2020-08-02,268명
외교/통일/국방,북한에 대한 인도적 지원을 중지할 것을 촉구합니다.,2020-08-02,989명
보건복지,'약국주인에게 마스크를 제공하는 것'이 의아하다는 홍 부총리의 발언에 대해 사과를 요청합니다.,2020-08-02,"6,574명"
인권/성평등,데이트 폭행 처벌 강화 해주세요,2020-08-02,"1,286명"
교통/건축/국토,김현미국토부장관 해임을 청원합니다,2020-08-02,"7,572명"
인권/성평등,네이버 웹툰 **** 연재 중지 시켜주세요.,2020-08-02,"2,121명"
안전/환경,구로차량기지 이전으로  인간다운 삶을 보장해 주세요! ( 신속한 지하철 건립 요청드립니다),2020-08-02,"7,465명"
저출산/고령화대책,난임지원,2020-08-02,938명
보건복지,광주광역시 코로나 확진자 동선을 명확히 공개해주세요,2020-08-02,"7,906명"
인권/성평등,LH공사 신혼희망타운 홍보영상 과연 이것이 정부가 원하는 방향 입니까??,2020-08-02,"1,819명"
기타,6.17 전세대출규제를 전국으로 확대 적용하여 주십시오.,2020-08-02,326명
문화/예술/체육/언론,입시생들의 꿈을 빼앗지 말아주세요,2020-08-02,823명
육아/교육,한림예고와 서울공연예술고등학교 입시준비중인 중3 학생을 도와주세요.,2020-08-02,719명
육아/교육,서울공연예술고등학교의 특,2020-08-02,353명
미래,양성평등 나라에서 먼저 시작해주세요,2020-08-02,624명
육아/교육,등교 자율화를 원합니다. 워킹맘들의 자녀들은 지금 아동학대를 당하고 있습니다.,2020-08-02,497명
교통/건축/국토,(6.17 부동산 정책) 80세 노모의 희망을 아시나요?,2020-08-02,437명
교통/건축/국토,무주택자 규제 완화,2020-08-02,686명
경제민주화,장기투자자에 대한 주식 양도소득세 비과세 방안이 필요합니다.,2020-08-02,"1,867명"
교통/건축/국토,6.17 대책 이전 계약자들에게 적용 된 소급적용을 철회해주세요.,2020-08-02,857명
교통/건축/국토,지방아파트 투기 개선이 필요합니다,2020-08-02,278명
교통/건축/국토,소급적용이라는 기준은 사람마다 다른가요?,2020-08-02,430명
교통/건축/국토,무주택자에 대한 융자는 풀어주세요,2020-08-02,540명
교통/건축/국토,617부동산정책 서민들을 살려주세요,2020-08-02,979명
교통/건축/국토,장항선 철도개량사업 구간 중 홍성군 신성역과 보령시 주포역 구간은 직선으로 노선을 획정해야 합니다.,2020-08-02,286명
기타,***** 장기미사용 휴대폰 요금폭탄 진상 조사해주세요,2020-08-02,208명
안전/환경,사기 중고거래 피해방지를 위한 '이체 경고 메세지 표시' + '수정된 지연인출제도 신청',2020-08-02,157명
경제민주화,식약처에서 내년 예정이라 부결 되었되었다는데요......,2020-08-02,127명
보건복지,요양원 사망사건,2020-08-02,259명
문화/예술/체육/언론,대한체육회를 해체하여 주십시오.,2020-08-01,"5,771명"
인권/성평등,갑질  공무원을 조치 해주시길 청원합니다!!!,2020-08-01,"1,026명"
문화/예술/체육/언론,******등이 Kpop의 정체성을 돈에 일본에 팔아먹는 행위를 막아주세요..,2020-08-01,691명
기타,억울하게 빼앗기게 생긴 저희 집을 구해주세요,2020-08-01,477명
인권/성평등,[청원] 고 최숙현 선수 사건의 철저한 조사와 재발 방지를 청원합니다,2020-08-01,"17,113명"
문화/예술/체육/언론,고 최숙현 선수의 죽음에 분노하며 대한체육회 해체를 촉구합니다,2020-08-01,"8,092명"
