분류,제목,만료날짜,참여인원
안전/환경,"n번방 운영진 와치맨에 대한 3년6개월 구형을 반대하며, 강력한 처벌과 신상공개를 요구합니다.",2020-04-23,"28,697명"
행정,"N번방  박사 조모군, 갓갓, 와치맨 등 가해자들의 온라인 금전을 몰수하여 아동청소년 성범죄 교육, 피해자지원금, 국가정책지원금으로 쓰이게 해주세요.",2020-04-23,"46,827명"
기타,N번방 전 운영자 와치맨을 제대로 처벌해 주십시오,2020-04-23,"2,869명"
육아/교육,텔레그램 'N번방' 전 운영자 와치맨의 신상공개와 형벌을 늘려주시길 바랍니다.,2020-04-23,"24,499명"
보건복지,해외 희귀의약품(멜팔란) 수급 문제를 조속히 해결 부탁드립니다.,2020-04-23,"5,209명"
일자리,유흥주점 종사자와 업주들은 어찌 살라고  대안도 없이,2020-04-23,"1,409명"
문화/예술/체육/언론,음원차트를 조작하는 사재기를 막아주세요,2020-04-23,"2,145명"
보건복지,코로나19가 종식될 때까지 실내 마스크 착용을 의무화해 주십시오.,2020-04-23,399명
외교/통일/국방,"코로나 진단 키트를 통해, 대한민국의 영토인 '독도'를 전 세계에 알릴 수 있게 해주세요.",2020-04-23,"34,768명"
미래,주식상장폐지하지마세요 흑자전환중이래요,2020-04-23,174명
문화/예술/체육/언론,2020 도쿄 올림픽 대한민국의 불참을 청원합니다.,2020-04-23,654명
보건복지,중국/유럽발 입출국 금지 및 공항에서의 즉각적인 시설 격리 요청,2020-04-23,"2,031명"
정치개혁,대통령님 자국민을 먼저 돌아봐주세요!!,2020-04-23,"2,426명"
보건복지,현재의 법에 저촉 되지 않는 바이오 신기술을 코로나환자 및 난치성질환자에 사용할 수 있게 승인해 주세요.,2020-04-23,211명
안전/환경,벼랑끝에 있는 재외 교민들에게 선제적 조치를 희망합니다,2020-04-23,701명
보건복지,외국인 입국금지 바랍니다,2020-04-23,"2,839명"
육아/교육,개학에 대해 현실적인 대안을 제시해주세요.,2020-04-23,"3,684명"
외교/통일/국방,아들(군인)에게 영화나 다큐멘타리 같은 콘텐츠를 보낼 수 있게 해주세요,2020-04-23,264명
교통/건축/국토,경남 합천군 **면 ***구 **마을 입구 사유지 점령으로 인해 마을 입구 봉쇄되어 주민들이 사비로 마을길을 만들고 있습니다. 제발 도와주세요~~,2020-04-23,310명
정치개혁,"코로나-19, 조기 종식을 위한 2주간 선택적 임시연휴 실시 및 자택 외 이동제한 실시 건의합니다.",2020-04-23,362명
보건복지,코로나19 대응 의료진 보상관련 간호조무사 차별대우,2020-04-23,"1,749명"
미래,자화자찬중이신 정부님들께 한 말씀 올립니다,2020-04-23,"4,758명"
외교/통일/국방,뉴질랜드 대한민국 전세기 부탁드립니다.,2020-04-23,"4,676명"
기타,코로나대출 개인회생 진행자 승인,2020-04-23,921명
기타,호주와 뉴질랜드에 있는 학생 및 워킹홀리데이비자를 소지한 국민들을 위한 전세기를 청원합니다,2020-04-23,"14,290명"
정치개혁,"정치적으로 편향되지 않고, 국익과 국민을 최우선으로 하는 정부가 되어주시길 읍소드립니다.",2020-04-23,779명
외교/통일/국방,호주에 거주하고 있는 대한민국 국적 유학생들과 워킹 홀리데이 비자 체류자들을 송환하기 위한 전세기를 요청합니다,2020-04-23,"1,192명"
일자리,코로나로 가정경제가 무너진 개인회생자에게 기회를 주세요.,2020-04-23,690명
교통/건축/국토,뉴질랜드 귀국 항공편을 도와주세요,2020-04-23,520명
육아/교육,올해 고3생들이 수능시험에 응시할 때 [재난 가산점]을 부여해 주십시오.,2020-04-23,609명
육아/교육,코로나로 인하여 인터넷 강의 등록금 반환제도 시행해주세요.,2020-04-23,"1,413명"
안전/환경,텔레그램 사건 피해자들을 위한 구조와 지원을 요구합니다.,2020-04-23,"1,086명"
안전/환경,고아가 된 초등학생에게 소송을 건 보험회사가 어딘지 밝혀주세요!,2020-04-23,"187,543명"
외교/통일/국방,호주에 국적기를 띄워주세요,2020-04-23,675명
보건복지,입국자 검사비 진료비 본인 부담 요청,2020-04-23,"2,284명"
문화/예술/체육/언론,방과후 강사 경제적 생계유지 대안을 촉구합니다.,2020-04-23,"2,567명"
보건복지,현직약사입니다. 마스크수급실태 개선요합니다.,2020-04-23,428명
육아/교육,( 코로나19 )어린이집.유.초.중.고 무기한휴교 해주세요.,2020-04-23,"6,572명"
외교/통일/국방,단기방문자 입국 금지,2020-04-23,"2,371명"
안전/환경,잔혹한 '관악구 모자 살인 사건'의 피의자 조모씨를 신상공개와 함께 엄벌에 처해 주세요!!,2020-04-23,"50,706명"
정치개혁,텔레그램 n번방 26만명 전원 벌금형 으로 5조이상 만들어 코로나 극복합시다.,2020-04-23,"1,349명"
보건복지,"대구 17세 소년의 마지막 말 ""엄마 나 아파"" 누가 보듬어 주나",2020-04-23,"14,087명"
외교/통일/국방,북미지역 귀국자를 위한 항공 직항노선 추가를 청원합니다.,2020-04-23,475명
행정,학원 및 교습소에 정부는 영업정지 권고에 대한 피해를 보상하라.,2020-04-23,"1,044명"
문화/예술/체육/언론,체육시설 운영중단 강력권고에 따른 지원방안을 마련해 주십시요.,2020-04-23,795명
인권/성평등,아동음란물 소지만으로도 강력히 처벌해 주세요.,2020-04-23,"2,619명"
보건복지,백화점 영업시간,2020-04-23,"4,122명"
기타,N번방 범죄인 처벌 - 외국은 몇십년 VS 한국은 몇 년 - 솜방망이 처벌을 바꿔주세요.,2020-04-23,"11,610명"
기타,"이 어려운 시기에 **택배 수수료 삭감이라니요,",2020-04-23,820명
안전/환경,n번방과 관련한 2차 가해자들을 엄중히 처벌해주세요. 나아가 2차 가해를 법률의 강화 개정을 통해 막아주세요.,2020-04-23,"4,466명"
교통/건축/국토,운전면허 취득기준을 대폭강화 해주세요,2020-04-23,892명
육아/교육,신학기 개학을 9월로 맞춰주시길 청원드립니다.,2020-04-22,"7,847명"
교통/건축/국토,분당선 연장선 제4차국가철도망계획에 넣어주세요(6차청원),2020-04-22,"1,061명"
문화/예술/체육/언론,휴관에 따른 프리랜서 강사들에 대한 대책 마련,2020-04-22,722명
안전/환경,5일장 자제하게 해주세요.,2020-04-22,580명
기타,사형수도 삼시세끼 세금으로 먹여주면서 청춘을 바쳐 평생을 모은 돈으로 강남권에 집 1채 산 것이 그렇게도 큰 죄입니까?],2020-04-22,"1,596명"
기타,문재인 대통령이 3월 20일에 했던 ‘강제집회금지’에 대한 당부의 말을 철회해주십시오!,2020-04-22,457명
행정,현충원에 '안장'된 친일파 이장을 위한 국립묘지법 개정을 촉구합니다!,2020-04-22,"16,888명"
문화/예술/체육/언론,진해 군항제는 취소되었습니다. 관광객의 방문을  금지해주세요,2020-04-22,"1,995명"
인권/성평등,N번방을 비롯하여 디지털 성범죄에 연루된 모든 사람을 공무원직에서 박탈해주세요. 특히 교사로서 일을 하지 못하도록 해주세요.,2020-04-22,"51,432명"
인권/성평등,대한민국 정부는 텔레그램에 정보 제공을 요청해 주시기 바랍니다.,2020-04-22,"3,159명"
인권/성평등,"성착취 채팅방 이용자 전원 색출 후 '성범죄자 알림e 등록', '취업 제한 직종 적용'을 해야합니다.",2020-04-22,"88,961명"
행정,잘못된 행정을 바로 잡아주세요,2020-04-22,189명
인권/성평등,"텔*그램 성범죄자들의 모임 ""고담방""을 잊어서는 안됩니다.",2020-04-22,"32,750명"
인권/성평등,'성폭력 범죄의 처벌 등에 관한 특례법'에 대한 실질적인 개정과 의제 강간 연령 상행을 강력하게 촉구합니다.,2020-04-22,"47,320명"
육아/교육,코로나 종식선언 또는 치료제 개발까지 휴교령과 수업 이수 방안을 마련해주세요!,2020-04-22,"58,561명"
안전/환경,미성년자가 엮여있는 문제에 자비는 없습니다 n번 박사방 유료회원 전부 신상공개는 물론이고 처벌을 원합니다,2020-04-22,"3,373명"
외교/통일/국방,"올해 예비군은 국민 전원 면제, 예비군 훈련 제도 개편 및 폐지를 요청합니다.",2020-04-22,291명
기타,해피벌룬 관련 법 강화를  요청합니다.,2020-04-22,362명
안전/환경,대형 폐기물 중 쓸 수 있는 물건이 재활용 되도록 도와주세요.,2020-04-22,267명
기타,휴대폰판매점 자영업자들을 살려주세요.,2020-04-22,936명
외교/통일/국방,이태리교민을 위한 전세기 지원 반대 청원합니다.,2020-04-22,"2,459명"
인권/성평등,N번방 가해자들을 성범죄 알림이에 등록시켜 주십시오.,2020-04-22,"64,934명"
인권/성평등,텔레그램 n번방 사건으로 피해입은 74명의 성폭력 피해자 분들과 추가될 수 있는 피해자분들의 정신건강 회복을 위한 지속적인 지원을 요구합니다.,2020-04-22,"3,726명"
보건복지,"""개성공단 마스크로 세계를 살려내자""   대통령은 트럼프에게 ‘긴급특별조치’ 제안하라!",2020-04-22,402명
경제민주화,펜더믹 사태에 예약한 여행 및 항공권을 쉽게 취소하고 환불받을 수 있는 정책을 만들어주세요.,2020-04-22,276명
안전/환경,텔레그렘 성노예 사건에 대한 특별법 제정 촉구,2020-04-22,"2,546명"
안전/환경,N번방 사건의 특별법 제정을 촉구합니다,2020-04-22,"5,767명"
기타,중국 복합문화타운 건설을 강력히 반대합니다.,2020-04-22,"35,335명"
안전/환경,n번방과 박사방의 피해자들을 지켜주세요.,2020-04-22,"5,894명"
보건복지,납입한 국민연금으로 코르나19사태로인한 국민들의 경제적 어려움을 해결해 주십시요.,2020-04-22,637명
교통/건축/국토,대구에 20대 보험사기꾼들 제발 구속시켜주세요,2020-04-22,815명
보건복지,충주시의 코로나 대응을 투명하게 해주세요,2020-04-22,"1,629명"
인권/성평등,모두 처벌해 주세요.,2020-04-22,"1,377명"
인권/성평등,페이스북 사이버 성범죄 가해자를 처벌해주세요.,2020-04-22,765명
보건복지,"이뮨메드가 개발 중인 염증성 바이러스질환 치료제 ‘HzVSF 13주(VSF)’ 임상2,3상 시험 정부 주도로 해주세요",2020-04-22,"1,193명"
문화/예술/체육/언론,‘실내 체육시설 운영 중단’ 권고조치에 따른 청원,2020-04-22,"5,053명"
인권/성평등,텔레그램 성착취 사건 피해자 분들의 치유 과정에 정부가 적극적으로 함께해주세요,2020-04-22,"2,820명"
보건복지,코로나 19때문에 외면 받는 다른 중환자들을 위한 병실 확보를 부탁드립니다.,2020-04-22,553명
안전/환경,텔레그램 박사방 입장자 전원의 신상 공개를 요청합니다.,2020-04-22,"8,311명"
행정,종교 · 실내 체육 등 15일간 중단…지침 어기면 처벌  정 총리 대국민  국민담화에 대한 이의제기입니다.,2020-04-22,"1,654명"
안전/환경,텔레그램 기록삭제를 해준다며 은폐에 가담하는 자들을 처벌해주세요.,2020-04-22,"2,409명"
안전/환경,'n번방 특검' 청원합니다.,2020-04-22,"2,970명"
안전/환경,성범죄 관련법 처벌을 강화해주십시오.,2020-04-22,"2,194명"
안전/환경,n번방 성착취 사건의 피해자 구제 방안과 유사 범죄 예방책을 수립해주십시오,2020-04-22,"1,085명"
기타,신외감법 회계 감사강화로 주)신* 국가채권(리**) 미확인으로 인한 억울한 상장폐지를 막아주세요.,2020-04-22,782명
보건복지,"서로 회피하는 17세 소년의 억울한 죽음, 누가 책임지나?",2020-04-22,"30,458명"
인권/성평등,n번방 이용자 신상 모조리 밝혀주세요.,2020-04-22,"1,314명"
보건복지,"유럽발 입국자 코로나 검사비용, 생활지원금 세금으로 내는 것 반대합니다",2020-04-22,"14,501명"
안전/환경,입국제한 좀 해주십시요.,2020-04-22,"4,873명"
기타,"n번방 창시자인 갓갓, 와치맨, 개인 정보 조회에 가담했던 사회복무요원까지 처벌해 주세요",2020-04-22,"125,662명"
안전/환경,'박사방'유료회원 중 사회지도층 또는 고위공직자의 존재 여부 조사 바랍니다.,2020-04-22,"1,917명"
인권/성평등,N번방을 만든 사람은 미성년자입니다. 소년법 개정이 필요합니다.,2020-04-22,"5,836명"
정치개혁,미성년자 성 착취에 가담한 n번방 가해자들을 제대로 처벌할 수 있는 법을 제정해주세요,2020-04-22,"3,641명"
육아/교육,"텔레그램 n번방 가입자 전원 신상 공개와 더불어 ‘의무 성교육’을 더욱 체계적, 현실적으로 개편해 주시기를 원합니다.",2020-04-22,"11,084명"
인권/성평등,N번방 사건 강력 처벌 요구와 디지털 성범죄 문제 해결 방안 촉구,2020-04-22,"2,966명"
인권/성평등,[텔레그램 n번방] 사회복무요원(공익)이 국민의 개인정보를 취급하지 못하도록 관련 규정을 개정해주시기 바랍니다.,2020-04-22,"11,026명"
인권/성평등,"디지털 성범죄, 성착취에 관한 상세한 처벌법의 입법과 디지털성범죄의 양형기준 재조정을 요구합니다.",2020-04-22,"1,643명"
보건복지,천안시 확진자 이동경로 공개를 제대로 해주세요,2020-04-22,727명
성장동력,벼랑 끝에 몰린 18만명을 외면하지 말아주십시요.,2020-04-22,389명
인권/성평등,"n번방 사건, 중한 성범죄의 인식강화 및 성범죄 형량 강화 강력요구합니다!",2020-04-22,"10,086명"
안전/환경,n번방 디지털 성범죄 수익을 몰수해 피해여성들의 정신적 피해에 대한 치료에 사용해주세요,2020-04-22,"57,229명"
기타,텔레그램 n번방의 운영자와 단톡방  참여자들 모두 엄중 처벌을 청원합니다,2020-04-22,879명
육아/교육,진주 아동학대 사건 2차가해 및 허위 명예훼손으로 고통받는 엄마입니다.,2020-04-22,"1,150명"
인권/성평등,"n번방, 박사방을 비롯한 모든 미성년자대상 범죄영상 시청자들의 신상공개를 요구합니다.",2020-04-22,"6,587명"
인권/성평등,텔레그램 n번방 단톡참여자 신상공개 및 강력한 처벌 부탁드립니다,2020-04-22,"4,733명"
인권/성평등,N번방 피해자들을 보호해주세요.,2020-04-22,"94,250명"
보건복지,유럽 유학생 자녀에게 마스크 허락 해주세요,2020-04-22,516명
인권/성평등,"몰카, 성관계 영상 유포, 성폭행 등 성범죄의 처벌을 강화해주세요",2020-04-22,"1,202명"
보건복지,식약처의 임상승인 신청 신속한 처리를 바랍니다,2020-04-22,691명
성장동력,4차산업 핵심인 양자암호통신 관련 법 및 예산지원 건의문,2020-04-22,792명
외교/통일/국방,[독도키트]해외로 수출되는 코로나 진단키트 이름변경 부탁드립니다.,2020-04-22,"2,113명"
보건복지,해외 입국 시 의무 자가격리 외 치료비부담,2020-04-22,"1,822명"
보건복지,코로나 치료에 중간엽줄기세포 치료를 허용해 주십시오.,2020-04-22,589명
교통/건축/국토,시내버스 재정지원을 촉구하며!,2020-04-22,158명
보건복지,모든 내/외국인 입국자를 본인비용부담으로 2주간 지정시설에 격리해주실 것을 청원합니다.,2020-04-22,"8,231명"
외교/통일/국방,"외국인 입국자 자비로 14일간 격리, 내국인 14일 자가격리 의무화로 코로나 해외유입 최소한 막아주세요.",2020-04-22,"2,700명"
안전/환경,제발좀 입국금지 시켜주세요.,2020-04-22,"1,256명"
보건복지,코로나19 조기종식을 위한 방안 청원,2020-04-22,239명
외교/통일/국방,현재 외국 입국자들 (특히 유럽) 자가격리 및 준수사항 위반할 시 강제 추방 혹은 영구 입국금지의 강력한 제재를 촉구합니다,2020-04-22,"1,325명"
문화/예술/체육/언론,간곡히 호소합니다. 국민의 눈높이에 상응하는 대책을 내놓아 주시기 간곡히 부탁드립니다.,2020-04-22,708명
행정,국가(정부)는 국민의 희생을 강요하는 대신 그 희생의 댓가가 무엇인지 상세하게 밝혀줄 것을 요구합니다...,2020-04-22,308명
행정,"종교,유흥,체육시설 중단하라고 하기전에",2020-04-22,820명
기타,국민에게 재난기본소득을 지급하라,2020-04-22,560명
보건복지,코로나 19 대처방법에 대한 청원,2020-04-22,291명
보건복지,숨쉬기 편리한 방진마스크를 세상에 알려주세요,2020-04-22,155명
안전/환경,공적마스크 진단시약등의 생산량을 더 많이 늘려서 유럽과 미국 도와줍시다.,2020-04-22,150명
교통/건축/국토,개인화물 운송에  퀵사무실 고이율  수수료,2020-04-22,310명
보건복지,"의사의 지도 없이 작업치료, 물리치료가 시행될 수 있게 해주세요",2020-04-22,274명
정치개혁,국회의원 월급을 최저시급으로 책정하고 실적에 따라 인센티브 받게 해주세요!,2020-04-22,"1,998명"
보건복지,**병원의료사고 대처 엉망이네요,2020-04-22,309명
기타,한국 발 해외출장을 당분간 막아주세요,2020-04-22,479명
보건복지,파견 간호사뿐 아니라 기존에 대구에서 코로나를 위해서 열심히 싸우고 있는 간호사들의 처우도 개선해주세요,2020-04-22,"5,253명"
안전/환경,"N번방 사건을 포함한 사이버 성범죄 처벌 법안을 구체화, 통과시키길 청원합니다.",2020-04-22,"8,255명"
경제민주화,어려운 현 시국에 지역경제활성화를 위한 정부의 힘이 필요합니다.,2020-04-22,126명
기타,정부는 교회 예배(집회)에 대한 행정적 조치를 철회해 주십시오.,2020-04-22,"71,377명"
보건복지,재난기본소득 100만원 지급방식(1+1정책) 청원,2020-04-22,431명
인권/성평등,여성으로써 살아가기 무섭습니다. 부디 저의 호소를 들어주세요.,2020-04-22,"1,231명"
보건복지,"마사지특허 받았다며 사기치는 남자 잡아주세요, 피부미용 자격증 제대로 쓰게 해주세요",2020-04-22,"10,136명"
보건복지,체계적인 간병인제도를 확립해주세요,2020-04-22,280명
문화/예술/체육/언론,아무런 대처 없이 영업장 닫아라,2020-04-22,547명
문화/예술/체육/언론,실내 체육시설 운영중단을 강력 권고를 하셨으면 지원책을 마련해 주십시오.,2020-04-22,"17,547명"
안전/환경,여행과  외출 자제라고 안전문자 보내시면서  왜 각종 소셜엔 여행상품이 계속올라오나요?,2020-04-22,246명
문화/예술/체육/언론,체육시설 및 교회 등 운영중단 권고에 따른 구체적인 대책이 궁금합니다.,2020-04-22,268명
보건복지,마스크독점,2020-04-22,215명
정치개혁,국회의원 주민소환제,2020-04-22,962명
경제민주화,"소상공인 긴급자금2,000만원  무이자로 대출지원을 청원합니다.",2020-04-22,323명
문화/예술/체육/언론,미****,2020-04-22,119명
육아/교육,법원에서 판결이 나와도 양육비 안줄려고  하는  부모들 사법처리해주세요.,2020-04-22,604명
육아/교육,****대학교(또는 다른학교)간호학과 실습을 막아주세요.,2020-04-22,287명
기타,전세버스업 근로자및 사각지대 근로자를 살펴주세요,2020-04-22,309명
인권/성평등,지인능욕 및 사이버 성범죄에 강력한 처벌을 요구합니다.,2020-04-22,"56,562명"
보건복지,입덧약(디클렉틴)의 의료보험혜택을 지원해주세요.,2020-04-22,196명
기타,**의 구** 씨의 원래 교제 상대 인 최** 항소심에서 집행 유예없이 징역 선고와 엄벌을 요구합니다. 또한 성 동영상 사건의 법 개정을.,2020-04-22,"11,205명"
육아/교육,'교육공무직' 채용 과정을 투명하게 밝혀주십시오.,2020-04-22,"6,497명"
인권/성평등,일간베스트 폐쇄,2020-04-22,"7,343명"
교통/건축/국토,민식이 법 개정을 청원합니다.,2020-04-22,"354,857명"
문화/예술/체육/언론,실내스포츠센터 요가 필라테스 강습금지에 대한 의견,2020-04-22,"3,206명"
육아/교육,유.초.중.고.대 학교의 5월 개학 및 개강 연기,2020-04-22,"7,851명"
보건복지,코로나19로 장사를 못하는 전국의 5일장 상인들과 지역의 노점상들에게 긴급 생활자금을 지원해 주세요.,2020-04-22,"1,671명"
일자리,체육시설 휴관에 따른 프리렌서 강사에 대한 대책 마련 촉구,2020-04-22,721명
정치개혁,소상공인 죽이는겁니까?,2020-04-22,726명
일자리,[실내체육시설 운영 중단]절실하게 호소합니다. 제발 살려주십시오..,2020-04-22,720명
인권/성평등,시대착오적이고 성차별적인 신혼부부 특별공급 소득조건을 개정해주세요.,2020-04-22,234명
보건복지,"故권대희 사건, 이래도 수술실CCTV 설치를 반대하시렵니까?",2020-04-22,"16,861명"
경제민주화,"제일평화 시장의 화재 원인과 화재로 인한 상인들의 피해보상, 추가적인 피해 방지를 막아주세요",2020-04-22,"2,360명"
인권/성평등,의제강간 연령 16세 상향조정,2020-04-22,"22,088명"
안전/환경,성폭력자사이버알리미법 만들어주세요,2020-04-22,"2,147명"
안전/환경,아동의 건강을 침해하는 유해환경으로부터 아동을 보호하기 위한 여러 가지 관련 보호구역을 “아동보호구역”으로 통합시켜주세요.,2020-04-22,159명
안전/환경,곧 출소하는 다크웹 운영자 손모씨를 미국에 송환보내주세요,2020-04-22,"8,856명"
육아/교육,안녕하십니까 저는 **고등학교 국정교과서 연구학교 지정을 반대했던 학생입니다.,2020-04-22,177명
인권/성평등,유/아동 성착취 동영상 유통시킨 다크웹 손모씨의 미국 법무부 강제송환을 실행해주십시오.,2020-04-22,"219,721명"
기타,"""동료 괴롭힘 직장 따돌림 "" 20대 여성 극단적 선택",2020-04-22,"42,678명"
육아/교육,"코로나 19의 장기화 대비, 대입 형평성, 초·중·고·대학교 학사 일정의 글로벌 스탠다드를",2020-04-21,"11,113명"
보건복지,코로나 검사결과만 기다리며 남편은 죽는중 입니다..,2020-04-21,"18,576명"
보건복지,고열환자 코로나 검사부터 해야합니다,2020-04-21,"5,975명"
일자리,프리랜서 자영업 정말 힘들어요 대책을마련해주세요!,2020-04-21,777명
문화/예술/체육/언론,태권도인을 아니 한거정의 가장을 살려주십시요..,2020-04-21,"1,250명"
문화/예술/체육/언론,학원 및 자영업자들을 살려주세요..,2020-04-21,"2,735명"
보건복지,관광통역안내사(가이드)의 '특수고용직' 인정을 청원합니다.,2020-04-21,"7,585명"
기타,소상공인 저리로 대환이라도 해주세요,2020-04-21,346명
보건복지,고용유지지원금을 소급적용해주세요.,2020-04-21,679명
교통/건축/국토,코로나로 인한 생계형 관광버스 지입차 사장님들 구제해 주세요,2020-04-21,"1,311명"
육아/교육,학교 수업관련 근로자 한시적 급여 조정 신청,2020-04-21,783명
기타,해외 가족들에게 조금의 마스크라도 보낼수 있도록 청원합니다,2020-04-21,491명
문화/예술/체육/언론,관광기금 상환유예관련,2020-04-21,119명
기타,도와주십시요 대통령님 저희가족좀 살려주십시요,2020-04-21,621명
경제민주화,자영업자의 어려움과 다중이용시설 행정명령에 대해 살펴봐주세요.,2020-04-21,462명
기타,절실하게 도움이 필요한 저신용자 소상공인에게도 기회를 주세요,2020-04-21,303명
보건복지,코로나19관련 임대주택 임대료갱신시 동결에관한 건의입니다.,2020-04-21,218명
미래,코로나19...‘따뜻한 눈길’ 캠페인,2020-04-21,131명
일자리,힘 없는 국민이 힘 있는 분들께 부탁드립니다.,2020-04-21,285명
육아/교육,고3은 무슨일이 있더라도 중간고사 폐지되면 안됩니다.,2020-04-21,393명
육아/교육,코로나19로 인한 현재의 비상상황을 계기로  9월 학기제 도입을 적극 검토할 것을 제안합니다.,2020-04-21,"3,317명"
행정,직접 세입자에게 혜택을 주세요!! 착한 임대인 감면정책 말고..,2020-04-21,322명
육아/교육,대학생 코로나 2학기 등록금 인하해주세요.,2020-04-21,"1,828명"
육아/교육,[코로나19 팬데믹 대응] 가을학기제 도입 청원,2020-04-21,"2,325명"
보건복지,마스크제조를 위한 공적설비시설 또는 국가가 운영하는 공장을 설립해 주세요.,2020-04-21,209명
보건복지,**생명 보험사의 횡포,2020-04-19,"1,426명"
안전/환경,코로나 이탈리아 전세기 지원을 반대합니다.,2020-04-19,"12,690명"
보건복지,이탈리아 교민의 대거 입국을 막아주세요.,2020-04-19,"25,465명"
보건복지,마스크 5부제 폐지해주세요.,2020-04-19,"2,372명"
문화/예술/체육/언론,인사이트 폐지를 청원합니다,2020-04-19,"11,676명"
경제민주화,미국과 통화스와프 추진 부탁드립니다,2020-04-19,571명
보건복지,해외 교민을 수송하는 정책을 멈춰주세요.,2020-04-19,"5,851명"
정치개혁,선거공보물 작업이 코로나19 확산의 변곡점이 될 수있습니다.,2020-04-19,307명
